{
  "schema": "dhp-verified-api-registry-v1",
  "version": "1.0.0",
  "reviewedAt": "2026-08-27",
  "providers": [
    {
      "id": "open-meteo",
      "name": "Open-Meteo",
      "category": "weather",
      "capabilities": ["weather.current", "weather.forecast", "weather.historical"],
      "tier": "A",
      "authority": "external-data-or-execution-only",
      "docs": "https://open-meteo.com/en/docs",
      "baseUrl": "https://api.open-meteo.com/v1",
      "auth": {"mode": "none", "notes": "Public endpoints do not require an API key; verify current usage terms for the intended workload."},
      "cost": {"class": "free_public", "denyMeteredOverflow": true, "notes": "Treat commercial/high-volume plans as separate opt-in providers, never an automatic fallback."},
      "policy": {"readOnlyByDefault": true, "cacheWhereAllowed": true, "respectRetryAfter": true, "verifyTermsAtActivation": true},
      "health": {"enabled": true, "method": "GET", "url": "https://api.open-meteo.com/v1/forecast?latitude=0&longitude=0&current=temperature_2m", "expectedStatus": [200]},
      "productionReady": false,
      "reviewNotes": "Preferred no-key weather seed. Project integration still needs its own timeout/cache/e2e evidence."
    },
    {
      "id": "frankfurter",
      "name": "Frankfurter",
      "category": "currency",
      "capabilities": ["currency.latest", "currency.historical", "currency.timeseries"],
      "tier": "A",
      "authority": "external-data-or-execution-only",
      "docs": "https://frankfurter.dev/",
      "baseUrl": "https://api.frankfurter.dev/v2",
      "auth": {"mode": "none", "notes": "Public API requires no API key."},
      "cost": {"class": "free_public", "denyMeteredOverflow": true, "notes": "Open source and self-hostable; do not silently switch to a paid FX feed."},
      "policy": {"readOnlyByDefault": true, "cacheWhereAllowed": true, "respectRetryAfter": true, "verifyTermsAtActivation": true},
      "health": {"enabled": true, "method": "GET", "url": "https://api.frankfurter.dev/v2/rates", "expectedStatus": [200]},
      "productionReady": false,
      "reviewNotes": "Useful for indicative/reference exchange-rate workflows; not an execution or trading-price authority."
    },
    {
      "id": "world-bank-indicators",
      "name": "World Bank Indicators API",
      "category": "economics",
      "capabilities": ["economics.indicators", "economics.country-data", "economics.timeseries"],
      "tier": "A",
      "authority": "external-data-or-execution-only",
      "docs": "https://datahelpdesk.worldbank.org/knowledgebase/articles/889392",
      "baseUrl": "https://api.worldbank.org/v2",
      "auth": {"mode": "none", "notes": "World Bank documents V2 API access without API keys."},
      "cost": {"class": "free_public", "denyMeteredOverflow": true},
      "policy": {"readOnlyByDefault": true, "cacheWhereAllowed": true, "respectRetryAfter": true, "verifyTermsAtActivation": true},
      "health": {"enabled": true, "method": "GET", "url": "https://api.worldbank.org/v2/country/all/indicator/SP.POP.TOTL?format=json&per_page=1", "expectedStatus": [200]},
      "productionReady": false,
      "reviewNotes": "Authoritative macro/public-data source; preserve indicator/source metadata and dates."
    },
    {
      "id": "crossref-rest",
      "name": "Crossref REST API",
      "category": "research",
      "capabilities": ["research.doi", "research.metadata", "research.works-search"],
      "tier": "A",
      "authority": "external-data-or-execution-only",
      "docs": "https://www.crossref.org/documentation/retrieve-metadata/rest-api/access-and-authentication/",
      "baseUrl": "https://api.crossref.org",
      "auth": {"mode": "optional", "notes": "Anonymous public access is supported; polite identification with contact information is recommended."},
      "cost": {"class": "free_public", "denyMeteredOverflow": true, "notes": "Premium Metadata Plus must never be auto-selected."},
      "policy": {"readOnlyByDefault": true, "cacheWhereAllowed": true, "respectRetryAfter": true, "verifyTermsAtActivation": true, "notes": "Prefer a descriptive User-Agent/mailto when the consuming host can supply it."},
      "health": {"enabled": true, "method": "GET", "url": "https://api.crossref.org/works?rows=0", "expectedStatus": [200]},
      "productionReady": false,
      "reviewNotes": "Strong metadata source; verify claims against primary publications when material."
    },
    {
      "id": "open-library",
      "name": "Open Library APIs",
      "category": "books",
      "capabilities": ["books.search", "books.metadata", "books.authors"],
      "tier": "A",
      "authority": "external-data-or-execution-only",
      "docs": "https://openlibrary.org/developers/api",
      "baseUrl": "https://openlibrary.org",
      "auth": {"mode": "none", "notes": "Public low-volume APIs; identified clients receive more generous rate limits."},
      "cost": {"class": "free_public", "denyMeteredOverflow": true},
      "policy": {"readOnlyByDefault": true, "cacheWhereAllowed": true, "respectRetryAfter": true, "verifyTermsAtActivation": true, "notes": "Not a bulk/high-traffic backend. Use data dumps for bulk workloads and identify the application for frequent requests."},
      "health": {"enabled": true, "method": "GET", "url": "https://openlibrary.org/search.json?q=construction&limit=1", "expectedStatus": [200]},
      "productionReady": false,
      "reviewNotes": "Use only for human-facing, low-volume discovery/lookup unless the project adopts Open Library's bulk-access path."
    },
    {
      "id": "wikimedia-action-api",
      "name": "Wikimedia / MediaWiki Action API",
      "category": "knowledge",
      "capabilities": ["knowledge.wikipedia", "knowledge.wikimedia", "knowledge.siteinfo"],
      "tier": "A",
      "authority": "external-data-or-execution-only",
      "docs": "https://www.mediawiki.org/wiki/API:Main_page",
      "baseUrl": "https://en.wikipedia.org/w/api.php",
      "auth": {"mode": "optional", "notes": "Many read requests work without authentication; authenticated flows are separate and require project approval."},
      "cost": {"class": "free_public", "denyMeteredOverflow": true},
      "policy": {"readOnlyByDefault": true, "cacheWhereAllowed": true, "respectRetryAfter": true, "verifyTermsAtActivation": true, "notes": "Use an informative User-Agent/Api-User-Agent, make considerate serial requests, batch where possible, and cache."},
      "health": {"enabled": true, "method": "GET", "url": "https://en.wikipedia.org/w/api.php?action=query&meta=siteinfo&format=json", "expectedStatus": [200]},
      "productionReady": false,
      "reviewNotes": "General knowledge evidence source, not project source of truth."
    },
    {
      "id": "github-rest-public",
      "name": "GitHub REST API",
      "category": "development",
      "capabilities": ["development.repositories", "development.issues", "development.commits", "development.public-code-metadata"],
      "tier": "A",
      "authority": "external-data-or-execution-only",
      "docs": "https://docs.github.com/en/rest",
      "baseUrl": "https://api.github.com",
      "auth": {"mode": "optional", "secretEnv": "GITHUB_TOKEN", "notes": "Public reads can be unauthenticated at lower rate limits; authenticated requests require least-privilege credentials."},
      "cost": {"class": "free_public", "denyMeteredOverflow": true},
      "policy": {"readOnlyByDefault": true, "cacheWhereAllowed": true, "respectRetryAfter": true, "verifyTermsAtActivation": true, "notes": "Writes are never authorized by this registry; use project/GitHub permission gates."},
      "health": {"enabled": true, "method": "GET", "url": "https://api.github.com/rate_limit", "expectedStatus": [200]},
      "productionReady": false,
      "reviewNotes": "Use authenticated host connectors when available instead of duplicating credentials or raw API plumbing."
    },
    {
      "id": "gemini-developer-api",
      "name": "Gemini Developer API",
      "category": "ai",
      "capabilities": ["ai.text", "ai.multimodal", "ai.structured-output", "ai.tool-calling"],
      "tier": "B",
      "authority": "external-data-or-execution-only",
      "docs": "https://ai.google.dev/gemini-api/docs",
      "baseUrl": "https://generativelanguage.googleapis.com",
      "auth": {"mode": "api-key", "secretEnv": "GEMINI_API_KEY", "notes": "Use a project-scoped key and current Google AI Studio / Gemini API eligibility."},
      "cost": {"class": "official_free_tier", "denyMeteredOverflow": true, "notes": "Only models/operations currently available in the official free tier are eligible for zero-cost routing."},
      "policy": {"readOnlyByDefault": true, "cacheWhereAllowed": false, "respectRetryAfter": true, "verifyTermsAtActivation": true, "notes": "Model availability, quotas, data-use terms, and region eligibility can change; verify before each production activation."},
      "health": {"enabled": false, "method": "MANUAL", "notes": "Credentialed model discovery/inference must be checked by the consuming host without exposing secrets."},
      "productionReady": false,
      "reviewNotes": "Preferred official free-tier AI candidate where DHP policy allows it; no paid-tier overflow."
    },
    {
      "id": "huggingface-inference-providers",
      "name": "Hugging Face Inference Providers",
      "category": "ai",
      "capabilities": ["ai.text", "ai.embeddings", "ai.classification", "ai.speech", "ai.image"],
      "tier": "B",
      "authority": "external-data-or-execution-only",
      "docs": "https://huggingface.co/docs/inference-providers/index",
      "baseUrl": "https://router.huggingface.co",
      "auth": {"mode": "bearer", "secretEnv": "HF_TOKEN", "notes": "Requires a Hugging Face user token for routed requests."},